id,name,semester,description,chapter,achievement,group_count,group_pos_x,group_pos_y
610,비율,초등-초6-1학기,"비 15:30에서 기호 :의 오른쪽에 있는 30은 기준량이고, 왼쪽에 있는 15는 비교하는 양입니다.\n기준량에 대한 비교하는 양의 크기를 비율이라고 합니다.\n$(비율)=(비교하는 양)\div(기준량)=\frac{(비교하는양)}{(기준량)}$\n비 15:30을 비율로 나타내 $\frac{15}{30}$ 또는 0.5입니다.","{'id': '384', 'name': '비와 비율 > 비율을 알아볼까요'}","{'id': '123', 'name': '비율을 이해하고, 비율을 분수, 소수, 백분율로 나타낼 수 있다.'}",19,10,0.37254901960784315
611,비율이 사용되는 경우 - 시간에 대한 거리의 비율 알아보기,초등-초6-1학기,"- 자동차를 타고 4시간 동안 200 km를 갔습니다. \n: 걸린 시간에 대한 간 거리의 비율을 구할 때 기준량은 걸린 시간(4시간)이고, 비교하는 양은 간 거리(200 km)입니다.\n>> 걸린 시간에 대한 간 거리의 비율은 \n$\frac{200}{4}(=50)$입니다.","{'id': '385', 'name': '비와 비율 > 비율이 사용되는 경우를 알아볼까요'}","{'id': '123', 'name': '비율을 이해하고, 비율을 분수, 소수, 백분율로 나타낼 수 있다.'}",20,10,0.39215686274509803
612,백분율,초등-초6-1학기,"기준량을 100으로 할 때의 비율을 백분율이라고 합니다. 백분율은 기호 %를 사용하여 나타냅니다. 비율 $\frac{75}{100}$를 75%라 쓰고 75퍼센트라고 읽습니다.\n$\frac{1}{100}=1$%, $\frac{75}{100}=75$%","{'id': '386', 'name': '비와 비율 > 백분율을 알아볼까요'}","{'id': '123', 'name': '비율을 이해하고, 비율을 분수, 소수, 백분율로 나타낼 수 있다.'}",21,10,0.4117647058823529
614,백분율이 사용되는 경우 - 할인율을 백분율로 나타내기,초등-초6-1학기,1500원인 볼펜을 1200원에 할인하여 판매하고 있습니다. - $(볼펜의 할인 금액)=1500-1200=300(원)$ → $(볼펜의 할인율)=\frac{300}{1500}=\frac{20}{100}=20%$,"{'id': '387', 'name': '비와 비율 > 백분율이 사용되는 경우를 알아볼까요'}","{'id': '123', 'name': '비율을 이해하고, 비율을 분수, 소수, 백분율로 나타낼 수 있다.'}",22,10,0.43137254901960786
615,그림그래프,초등-초6-1학기,알려고 하는 수(조사한 수)를 그림으로 나타낸 그래프를 그림그래프라고 합니다.,"{'id': '388', 'name': '여러 가지 그래프 > 그림그래프로 나타내어 볼까요'}","{'id': '295', 'name': '실생활 자료를 수집하여 그림그래프로 나타낼 수 있다.'}",23,10,0.45098039215686275
616,띠그래프,초등-초6-1학기,전체에 대한 각 부분의 비율을 띠 모양에 나타낸 그래프를 띠그래프라고 합니다.\n- 띠그래프는 전체에 대한 각 부분의 비율을 한눈에 알아볼 수 있습니다.,"{'id': '389', 'name': '여러 가지 그래프 > 띠그래프를 알아볼까요'}","{'id': '300', 'name': '주어진 자료를 띠그래프와 원그래프로 나타낼 수 있다.'}",24,10,0.47058823529411764
617,띠그래프로 나타내기,초등-초6-1학기,* 띠그래프로 나타내는 방법\n(1) 자료를 보고 각 항목의 백분율을 구합니다.\n(2) 각 항목의 백분율의 합계가 100 %가 되는지 확인합니다.\n(3) 각 항목들이 차지하는 백분율의 크기만큼 선을 그어 띠를 나눕니다.\n(4) 나눈 부분에 각 항목의 내용과 백분율을 씁니다.\n(5) 띠그래프의 제목을 씁니다.,"{'id': '390', 'name': '여러 가지 그래프 > 띠그래프로 나타내어 볼까요'}","{'id': '300', 'name': '주어진 자료를 띠그래프와 원그래프로 나타낼 수 있다.'}",25,10,0.49019607843137253
618,원그래프,초등-초6-1학기,전체에 대한 각 부분의 비율을 원 모양에 나타낸 그래프를 원그래프라고 합니다.,"{'id': '391', 'name': '여러 가지 그래프 > 원그래프를 알아볼까요'}","{'id': '300', 'name': '주어진 자료를 띠그래프와 원그래프로 나타낼 수 있다.'}",26,10,0.5098039215686274
619,원그래프로 나타내기,초등-초6-1학기,* 원그래프로 나타내는 방법\n(1) 자료를 보고 각 항목의 백분율을 구합니다.\n(2) 각 항목의 백분율의 합계가 100 %가 되는지 확인합니다.\n(3) 각 항목들이 차지하는 백분율의 크기만큼 선을 그어 원을 나눕니다.\n(4) 나눈 부분에 각 항목의 내용과 백분율을 씁니다.\n(5) 원그래프의 제목을 씁니다.,"{'id': '392', 'name': '여러 가지 그래프 > 원그래프로 나타내어 볼까요'}","{'id': '300', 'name': '주어진 자료를 띠그래프와 원그래프로 나타낼 수 있다.'}",27,10,0.5294117647058824
623,직육면체의 부피,초등-초6-1학기,$(직육면체의부피)=(가로)\times(세로)\times(높이)=(밑면의넓이)\times(높이)$,"{'id': '396', 'name': '직육면체의 부피와 겉넓이 > 직육면체의 부피를 구하는 방법을 알아볼까요'}","{'id': '269', 'name': '직육면체와 정육면체의 부피를 구하는 방법을 이해하고, 이를 구할 수 있다.'}",28,10,0.5490196078431373
624,정육면체의 부피,초등-초6-1학기,$(정육면체의부피)=(한모서리의길이)\times(한모서리의길이)\times(한모서리의길이)$,"{'id': '396', 'name': '직육면체의 부피와 겉넓이 > 직육면체의 부피를 구하는 방법을 알아볼까요'}","{'id': '269', 'name': '직육면체와 정육면체의 부피를 구하는 방법을 이해하고, 이를 구할 수 있다.'}",29,10,0.5686274509803921
625,$1m^3$,초등-초6-1학기,"한 모서리의 길이가 1m인 정육면체의 부피를 $1m^3$라 쓰고, 1 세제곱미터라고 읽습니다.","{'id': '397', 'name': '직육면체의 부피와 겉넓이 > m^3를 알아볼까요'}","{'id': '268', 'name': '부피를 이해하고, 1cm^3, 1m^3의 단위를 알며, 그 관계를 이해한다.'}",30,10,0.5882352941176471
626,$1m^3$와 $1cm^3$ 사이의 관계,초등-초6-1학기,$1m^3=1000000cm^3$,"{'id': '397', 'name': '직육면체의 부피와 겉넓이 > m^3를 알아볼까요'}","{'id': '268', 'name': '부피를 이해하고, 1cm^3, 1m^3의 단위를 알며, 그 관계를 이해한다.'}",31,10,0.6078431372549019
627,직육면체의 겉넓이 ,초등-초6-1학기,방법1: 여섯 면의 넓이의 합으로 구하기\n방법2: 세 쌍의 면이 합동인 성질을 이용하여 구하기\n방법3: 두 밑면과 옆면의 넓이의 합으로 구하기,"{'id': '398', 'name': '직육면체의 부피와 겉넓이 > 직육면체의 겉넓이를 구하는 방법을 알아볼까요'}","{'id': '267', 'name': '직육면체와 정육면체의 겉넓이를 구하는 방법을 이해하고, 이를 구할 수 있다.'}",32,10,0.6274509803921569
628,정육면체의 겉넓이,초등-초6-1학기,방법1: 여섯 면의 넓이의 합으로 구하기\n방법2: 한 면의 넓이를 6배 하여 구하기,"{'id': '398', 'name': '직육면체의 부피와 겉넓이 > 직육면체의 겉넓이를 구하는 방법을 알아볼까요'}","{'id': '267', 'name': '직육면체와 정육면체의 겉넓이를 구하는 방법을 이해하고, 이를 구할 수 있다.'}",33,10,0.6470588235294118
7224,$1\div(자연수)$의 몫을 분수로 나타내기,초등-초6-1학기,"$1\div(자연수)$의 몫은 1을 분자, 나누는 수를 분모로 하는 분수로 나타냅니다.\n$1\div■=\frac{1}{■}$","{'id': '364', 'name': '분수의 나눗셈 > (자연수)÷(자연수)의 몫을 분수로 나타내어 볼까요 (1)'}","{'id': '71', 'name': '‘(자연수)/(자연수)’에서 나눗셈의 몫을 분수로 나타낼 수 있다.'}",34,10,0.6666666666666666
7225,1보다 작은 $(자연수)\div(자연수)$의 몫을 분수로 나타내기,초등-초6-1학기,"$(자연수)\div(자연수)$의 몫은 나누어지는 수를 분자, 나누는 수를 분모로 하는 분수로 나타냅니다.\n$▲\div■=\frac{▲}{■}$","{'id': '364', 'name': '분수의 나눗셈 > (자연수)÷(자연수)의 몫을 분수로 나타내어 볼까요 (1)'}","{'id': '71', 'name': '‘(자연수)/(자연수)’에서 나눗셈의 몫을 분수로 나타낼 수 있다.'}",35,10,0.6862745098039216
7226,1보다 큰 $(자연수)\div(자연수)$의 몫을 분수로 나타내기,초등-초6-1학기,"몫은 나누어지는 수를 분자, 나누는 수를 분모로 하는 분수로 나타냅니다.","{'id': '365', 'name': '분수의 나눗셈 > (자연수)÷(자연수)의 몫을 분수로 나타내어 볼까요 (2)'}","{'id': '71', 'name': '‘(자연수)/(자연수)’에서 나눗셈의 몫을 분수로 나타낼 수 있다.'}",36,10,0.7058823529411765
7227,분자가 자연수의 배수인 $(분수)\div(자연수)$,초등-초6-1학기,* 분자가 자연수의 배수인 $(분수)\div(자연수)$의 계산 방법 : 분수의 분자를 자연수로 나눕니다.,"{'id': '366', 'name': '분수의 나눗셈 > (분수)÷(자연수)를 알아볼까요'}","{'id': '72', 'name': '‘(분수)/(자연수)’의 계산원리를 이해하고 그 계산을 할 수 있다.'}",37,10,0.7254901960784313
7228,분자가 자연수의 배수가 아닌 $(분수)\div(자연수)$,초등-초6-1학기,* 분자가 자연수의 배수가 아닌 $(분수)\div(자연수)$의 계산 방법 : 분수를 크기가 같은 분수 중에서 분자가 자연수의 배수인 수로 바꾸어 계산합니다.,"{'id': '366', 'name': '분수의 나눗셈 > (분수)÷(자연수)를 알아볼까요'}","{'id': '72', 'name': '‘(분수)/(자연수)’의 계산원리를 이해하고 그 계산을 할 수 있다.'}",38,10,0.7450980392156863
7229,$(분수)\div(자연수)$를 분수의 곱셈으로 나타내기,초등-초6-1학기,* $(분수)\div(자연수)$의 계산 방법\n- $(진분수)\div(자연수)$: 자연수를$\frac{1}{(자연수)}$로 바꾼 다음 곱합니다.,"{'id': '367', 'name': '분수의 나눗셈 > (분수)÷(자연수)를 분수의 곱셈으로 나타내어 볼까요'}","{'id': '72', 'name': '‘(분수)/(자연수)’의 계산원리를 이해하고 그 계산을 할 수 있다.'}",39,10,0.7647058823529411
7230,$(대분수)\div(자연수)$,초등-초6-1학기,분자가 자연수의 -배수일 때에는 분자를 자연수로 나눕니다.\n분자가 자연수의 배수가 아닐 때에는 분수를 크기가 같은 분수 중에서 분자가 자연수의 배수인 수로 바꾸어 계산합니다.\n분수의 곱셈으로 나타내어 계산합니다.,"{'id': '368', 'name': '분수의 나눗셈 > (대분수)÷(자연수)를 알아볼까요'}","{'id': '72', 'name': '‘(분수)/(자연수)’의 계산원리를 이해하고 그 계산을 할 수 있다.'}",40,10,0.7843137254901961
9232,어림셈하여 몫의 소수점 위치 찾기,초등-초6-1학기,* 어림셈하여 몫의 소수점 위치 찾기\n(1) 계산 결과 어림하기\n(2) 몫의 소수점 위치 찾기,"{'id': '381', 'name': '소수의 나눗셈 > 몫의 소수점 위치를 확인해 볼까요'}","{'id': '78', 'name': '소수의 곱셈과 나눗셈의 계산 결과를 어림할 수 있다.'}",41,10,0.803921568627451
9557,그림그래프로 나타내기,초등-초6-1학기,"우리나라 권역별 119 구조 건수를 조사하여 표와 그림그래프로 나타내었습니다.\n[권역] : [구조 건수(만 건)]\n- 서울, 인천, 경기 : 31\n- 강원 : 3\n- 대전, 세종, 충청 : 6\n- 대구, 부산, 울산, 경상 : 16\n- 광주, 전라 : 8\n- 제주 : 1\n * 그림그래프에서 ◎은 10만 건, ○은 1만 건을 나타냅니다.\n* 119 구조 건수가 가장 많은 지역은 서울, 인천, 경기 권역이고, 가장 적은 권역은 제주 권역입니다.\n* 대구, 부산, 울산, 경상 권역의 119 구조 건수(16만 건)는 광주, 전라 권역의 119 구조 건수(8만 건)의 2배($16만\div8만=2(배)$)입니다.","{'id': '388', 'name': '여러 가지 그래프 > 그림그래프로 나타내어 볼까요'}","{'id': '295', 'name': '실생활 자료를 수집하여 그림그래프로 나타낼 수 있다.'}",42,10,0.8235294117647058
9590,여러 가지 그래프,초등-초6-1학기,"[그림그래프]\n- 수량의 많고 적음을 쉽게 알 수 있습니다.\n- 자료에 따라 상징적인 그림을 사용할 수 있어서 재미있게 나타낼 수 있습니다.\n[막대그래프]\n- 수량의 많고 적음을 한눈에 비교하기 쉽습니다.\n- 각각의 자료의 수량을 비교하기 편리합니다.\n[꺾은선 그래프]\n- 수량의 변화하는 모습과 정도를 쉽게 알 수 있습니다.\n- 시간에 따라 연속적으로 변하는 양을 나타내는데 편리합니다.\n[띠그래프, 원그래프]\n- 전체에 대한 각 부분의 비율을 한눈에 알아보기 쉽습니다.\n- 각 항목끼리의 비율을 쉽게 비교할 수 있습니다.","{'id': '394', 'name': '여러 가지 그래프 > 여러 가지 그래프를 비교해 볼까요'}","{'id': '128', 'name': '다양한 상황을 그래프로 나타내고, 주어진 그래프를 해석할 수 있다.'}",43,10,0.8431372549019608
10403,직육면체의 부피 비교,초등-초6-1학기,"* 직접 비교하기\n- 직접 면끼리 대어 봅니다.\n→ 밑면의 가로와 세로, 높이가 각각 다르므로 부피를 비교하기 어렵습니다.\n* 임의 단위를 이용하여 비교하기\n- 모양과 크기가 같은 작은 물건을 담아 봅니다.\n→ 담을 수 있는 물건의 수를 비교하면 가의 부피가 더 큽니다.\n* 모형을 사용하여 비교하기\n- 모양과 크기가 같은 모형을 직육면체 모양으로 쌓아 봅니다.\n→ 사용한 모형의 수를 비교하면 가의 부피가 더 큽니다.\n** 직육면체의 부피를 직접 비교할 수 있는 경우\n- 밑면의 넓이가 같으면 높이가 높을수록 부피가 큽니다.\n- 높이가 같으면 밑면의 넓이가 넓을수록 부피가 큽니다.","{'id': '395', 'name': '직육면체의 부피와 겉넓이 > 직육면체의 부피를 비교해 볼까요'}","{'id': '200', 'name': '입체도형의 겉넓이와 부피를 구할 수 있다.'}",44,10,0.8627450980392157
10404,$1cm^3$,초등-초6-1학기,"부피를 이해하고, 1cm^3, 1m^3의 단위를 알며, 그 관계를 이해한다.","{'id': '396', 'name': '직육면체의 부피와 겉넓이 > 직육면체의 부피를 구하는 방법을 알아볼까요'}","{'id': '268', 'name': '부피를 이해하고, 1cm^3, 1m^3의 단위를 알며, 그 관계를 이해한다.'}",45,10,0.8823529411764706
10405,부피가 $1cm^3$인 쌓기나무의 수를 세어 직육면체의 부피 구하기,초등-초6-1학기,부피가 $1cm^3$인 쌓기나무의 수: 12개\n→ 직육면체의 부피: $12cm^3$,"{'id': '396', 'name': '직육면체의 부피와 겉넓이 > 직육면체의 부피를 구하는 방법을 알아볼까요'}","{'id': '268', 'name': '부피를 이해하고, 1cm^3, 1m^3의 단위를 알며, 그 관계를 이해한다.'}",46,10,0.9019607843137255
10603,비율이 사용되는 경우 - 넓이에 대한 인구의 비율 알아보기,초등-초6-1학기,비와 비율 > 비율이 사용되는 경우를 알아볼까요,"{'id': '385', 'name': '비와 비율 > 비율이 사용되는 경우를 알아볼까요'}","{'id': '123', 'name': '비율을 이해하고, 비율을 분수, 소수, 백분율로 나타낼 수 있다.'}",47,10,0.9215686274509803
10604,백분율이 사용되는 경우 - 득표율을 백분율로 나타내기,초등-초6-1학기,"전교 어린이 회장 선거에서 400명이 투표에 참여했습니다.\n- 후보 가 득표수(표) : 208\n- 후보 나 득표수(표) : 188\n- 무효표 득표수(표) : 4\n- 가 후보의 득표율은$\frac{208}{400}\times100=52$(%)이고, 나 후보의 득표율은 $\frac{188}{400}\times100=47$(%)입니다.\n- 무효표는 $\frac{4}{400}\times100=1$(%)입니다.($100-(52+47)=1$ → 1%로 구할 수고 있습니다.)","{'id': '387', 'name': '비와 비율 > 백분율이 사용되는 경우를 알아볼까요'}","{'id': '123', 'name': '비율을 이해하고, 비율을 분수, 소수, 백분율로 나타낼 수 있다.'}",48,10,0.9411764705882353
10605,그래프 해석하기,초등-초6-1학기,지호네 마을의 가족 수별 가구 수를 조사하여 나타낸 띠그래프입니다.\n- 1인 (27%)\n- 2인 (26%)\n- 3인 (21%)\n- 4인 (19%)\n- 5인 이상 (7%)\n→ 1인 가구 수가 가장 많습니다.\n→ 1인\n→ 1인(27%) 또는 2인(26%) 가구 수는 전체의 53%($27+26=53(%)$)입니다.\n→  3인(21%) 가구 수는 5인 이상(7%) 가구 수의 3배($21\div7=3(배)$)입니다.,"{'id': '393', 'name': '여러 가지 그래프 > 그래프를 해석해 볼까요'}","{'id': '128', 'name': '다양한 상황을 그래프로 나타내고, 주어진 그래프를 해석할 수 있다.'}",49,10,0.9607843137254902
10606,원그래프를 보고 해석하기,초등-초6-1학기,"현욱이네 집의 쓰레기 종류별 발생량을 조사하여 나타낸 원그래프입니다. 그래프를 해석해 봅시다.\n(음식물 48.3%, 종이류 19.2%, 플라스틱류 15%, 비닐류 9.5%, 기타 8%)\n-가장 많이 발생하는 쓰레기는 음식물입니다.\n-비율이 10% 이상인 쓰레기는 음식물, 종이류, 플라스틱류입니다.\n-종이류 또는 플라스틱류 발생량은 전체의 34.2%입니다.","{'id': '393', 'name': '여러가지 그래프 > 그래프를 해석해 볼까요'}","{'id': '128', 'name': '다양한 상황을 그래프로 나타내고, 주어진 그래프를 해석할 수 있다.'}",50,10,0.9803921568627451
705,분자끼리 나누어떨어지지 않는 분모가 같은 $(분수)\div(분수)$,초등-초6-2학기,분자끼리 나누어 계산하고 분자끼리 나누어 떨어지지 않으므로 몫을 분수로 나타냅니다.\n$\frac{★}{♥}\div\frac{◆}{♥}=★\div◆=\frac{★}{◆}$,"{'id': '400', 'name': '분수의 나눗셈 > (분수)÷(분수)를 알아볼까요 (2)'}","{'id': '73', 'name': '‘(자연수)/(분수)’, ‘(분수)/(분수)’의 계산 원리를 이해하고 그 계산을 할 수 있다.'}",0,11,0.0
706,분모가 다른 $(분수)\div(분수)$,초등-초6-2학기,두 분수를 통분하여 분자끼리 나누어 계산합니다.,"{'id': '401', 'name': '분수의 나눗셈 > (분수)÷(분수)를 알아볼까요 (3)'}","{'id': '73', 'name': '‘(자연수)/(분수)’, ‘(분수)/(분수)’의 계산 원리를 이해하고 그 계산을 할 수 있다.'}",1,11,0.022727272727272728
707,$(자연수)\div(분수)$,초등-초6-2학기,자연수를 분수의 분자로 나눈 값에 분수의 분모를 곱하여 구합니다.\n$■\div\frac{▲}{●}=(■\div▲)\times●$,"{'id': '402', 'name': '분수의 나눗셈 > (자연수)÷(분수)를 알아볼까요'}","{'id': '73', 'name': '‘(자연수)/(분수)’, ‘(분수)/(분수)’의 계산 원리를 이해하고 그 계산을 할 수 있다.'}",2,11,0.045454545454545456
708,$(분수)\div(분수)$를 $(분수)\times(분수)$로 나타내는 방법,초등-초6-2학기,나눗셈을 곱셈으로 나타내고 나누는 분수의 분모와 분자를 바꾸어 줍니다.\n$\frac{■}{★}\div\frac{▲}{●}=\frac{■}{★}\times\frac{●}{▲}$,"{'id': '403', 'name': '분수의 나눗셈 > (분수)÷(분수)를 (분수)ⅹ(분수)로 나타내어 볼까요'}","{'id': '73', 'name': '‘(자연수)/(분수)’, ‘(분수)/(분수)’의 계산 원리를 이해하고 그 계산을 할 수 있다.'}",3,11,0.06818181818181818
709,$(분수)\div(분수)$,초등-초6-2학기,* $(대분수)\div(분수)$의 계산 방법 \n(1) 대분수를 가분수로 바꾸고 통분하여 분자끼리 나누어 계산하기\n(2) 대분수를 가분수로 바꾸고 분수의 곱셈으로 나타내어 계산하기,"{'id': '404', 'name': '분수의 나눗셈 > (분수)÷(분수)를 계산해 볼까요'}","{'id': '73', 'name': '‘(자연수)/(분수)’, ‘(분수)/(분수)’의 계산 원리를 이해하고 그 계산을 할 수 있다.'}",4,11,0.09090909090909091
710,$(소수)\div(소수)$,초등-초6-2학기,나누는 수와 나누어지는 수에 똑같이 10배 또는 100배를 하여 $(자연수)\div(자연수)$로 계산합니다.,"{'id': '405', 'name': '소수의 나눗셈 > (소수)÷(소수)를 알아볼까요 (1)'}","{'id': '77', 'name': '‘(자연수)/(소수)’, ‘(소수)/(소수)’의 계산 원리를 이해하고 그 계산을 할 수 있다.'}",5,11,0.11363636363636363
711,자릿수가 같은 $(소수)\div(소수)$,초등-초6-2학기,-소수를 분수로 바꾸어 분수의 나눗셈으로 계산합니다.\n-나누는 수와 나누어지는 수를 똑같이 10배 또는 100배를 하여 자연수의 나눗셈으로 계산합니다.\n-나누는 수와 나누어지는 수의 소수점을 오른쪽으로 똑같이 옮겨 세로로 계산합니다.,"{'id': '406', 'name': '소수의 나눗셈 > (소수)÷(소수)를 알아볼까요 (2)'}","{'id': '77', 'name': '‘(자연수)/(소수)’, ‘(소수)/(소수)’의 계산 원리를 이해하고 그 계산을 할 수 있다.'}",6,11,0.13636363636363635
712,자릿수가 다른 $(소수)\div(소수)$,초등-초6-2학기,-나누는 수와 나누어지는 수를 똑같이 10배 또는 100배를 하여 계산합니다.\n-나누는 수 또는 나누어지는 수가 자연수가 되도록 나누는 수와 나누어지는 수의 소수점을 오른쪽으로 똑같이 옮겨 계산합니다.,"{'id': '407', 'name': '소수의 나눗셈 > (소수)÷(소수)를 알아볼까요 (3)'}","{'id': '77', 'name': '‘(자연수)/(소수)’, ‘(소수)/(소수)’의 계산 원리를 이해하고 그 계산을 할 수 있다.'}",7,11,0.1590909090909091
713,$(자연수)\div(소수)$,초등-초6-2학기,-소수를 분수로 바꾸어 분수의 나눗셈으로 계산합니다.\n-나누는 수와 나누어지는 수를 똑같이 10배 또는 100배를 하여 자연수의 나눗셈으로 계산합니다.\n-나누는 수와 나누어지는 수의 소수점을 오른쪽으로 똑같이 옮겨 세로로 계산합니다.,"{'id': '408', 'name': '소수의 나눗셈 > (자연수)÷(소수)를 알아볼까요'}","{'id': '77', 'name': '‘(자연수)/(소수)’, ‘(소수)/(소수)’의 계산 원리를 이해하고 그 계산을 할 수 있다.'}",8,11,0.18181818181818182
714,몫을 반올림하여 나타내기,초등-초6-2학기,나눗셈의 몫이 나누어떨어지지 않아서 정확하게 구할 수 없을 때에는 몫을 반올림하여 나타낼 수 있습니다.,"{'id': '409', 'name': '소수의 나눗셈 > 몫을 반올림하여 나타내어 볼까요'}","{'id': '76', 'name': '‘(자연수)/(자연수)’, ‘(소수)/(자연수)’에서 나눗셈의 몫을 소수로 나타낼 수 있다.'}",9,11,0.20454545454545456
770,나누어 주고 남는 양,초등-초6-2학기,-나누어지는 수에서 나누는 수를 몇 번 빼고 남은 수가 '나누어 주고 남는 양'이 됩니다.\n-세로로 계산하여 몫을 자연수 부분까지 구했을 때 남은 수가 '나누어 주고 남는 양'이 됩니다. 이때 나누어 주고 남는 양을 구할 때에는 소수점의 위치에 주의합니다.,"{'id': '410', 'name': '소수의 나눗셈 > 나누어 주고 남는 양을 알아볼까요'}","{'id': '77', 'name': '‘(자연수)/(소수)’, ‘(소수)/(소수)’의 계산 원리를 이해하고 그 계산을 할 수 있다.'}",10,11,0.22727272727272727
1422,쌓기나무로 쌓은 모양과 위에서 본 모양을 보고 쌓은 모양과 쌓기나무의 개수 구하기,초등-초6-2학기,,"{'id': '411', 'name': '공간과 입체 > 쌓은 모양과 쌓기나무의 개수를 알아볼까요 (1)'}","{'id': '197', 'name': '쌓기나무로 만든 입체도형의 위, 앞, 옆에서 본 모양을 표현할 수 있고, 이러한 표현을 보고 입체도형의 모양을 추측할 수 있다.'}",11,11,0.25
1439,"쌓기나무를 쌓아 만든 모양을 보고 위, 앞, 옆에서 본 모양 그리기",초등-초6-2학기,쌓기나무를 앞과 옆에서 본 모양은 각 방향에서 각 줄의 가장 높은 층의 모양과 같습니다.,"{'id': '412', 'name': '공간과 입체 > 쌓은 모양과 쌓기나무의 개수를 알아볼까요 (2)'}","{'id': '197', 'name': '쌓기나무로 만든 입체도형의 위, 앞, 옆에서 본 모양을 표현할 수 있고, 이러한 표현을 보고 입체도형의 모양을 추측할 수 있다.'}",12,11,0.2727272727272727
1440,위에서 본 모양에 수를 쓰는 방법으로 쌓은 모양과 쌓기나무의 개수 구하기,초등-초6-2학기,(쌓은 모양의 각 자리에 기호를 붙인 것입니다.)-(위에서 본 모양의 각 자리에 기호를 붙인 것입니다.)-(위에서 본 모양의 각 자리에 쌓은 쌓기나무의 개수를 쓴 것입니다.)\n- 위에서 본 모양에 수를 쓰는 방법 : 사용된 쌓기나무의 개수를 한 가지 경우로만 알 수 있기 때문에 쌓은 모양을 정확하게 알 수 있습니다.,"{'id': '413', 'name': '공간과 입체 > 쌓은 모양과 쌓기나무의 개수를 알아볼까요 (3)'}","{'id': '197', 'name': '쌓기나무로 만든 입체도형의 위, 앞, 옆에서 본 모양을 표현할 수 있고, 이러한 표현을 보고 입체도형의 모양을 추측할 수 있다.'}",13,11,0.29545454545454547
