id,name,semester,description,chapter,achievement,group_count,group_pos_x,group_pos_y
1248,이차함수,중등-중3-1학기,"함수 $y=f(x)$에서 $y=ax^2+bx+c$ (a, b, c는 상수, $a\ne0$)와 같이 y가 x의 이차식으로 나타날 때, 이 함수를 x에 대한 이차함수라 한다.","{'id': '523', 'name': '이차함수 > 이차함수와 그래프 > 이차함수의 뜻'}","{'id': '135', 'name': '이차함수의 의미를 이해하고, 그 그래프를 그릴 수 있다.'}",14,16,0.18666666666666668
1249,이차함수 $y=ax^2$의 그래프의 성질,중등-중3-1학기,"(1) 원점 $O(0, 0)$을 꼭짓점으로 하는 포물선이다.\n(2) $y$ 축에 대칭이다.\n축의 방정식: $x=0$ ($y$ 축)\n(3) $a$의 부호에 따라 그래프의 모양이 달라진다.\n(3). 1. $a>0$일 때, 아래로 볼록하다.\n(3). 2. $a<0$일 때, 위로 볼록하다.\n(4) $a$의 절댓값이 클수록 그래프의 폭이 좁아진다.\n(5) $y=-ax^2$의 그래프와 $x$ 축에 서로 대칭이다.","{'id': '524', 'name': '이차함수 > 이차함수와 그래프 > 이차함수 y=ax^2의 그래프'}","{'id': '135', 'name': '이차함수의 의미를 이해하고, 그 그래프를 그릴 수 있다.'}",15,16,0.2
1250,이차함수 $y=ax^2+q$의 그래프의 성질,중등-중3-1학기,"(1) 이차함수 $y=ax^2$의 그래프를 $y$ 축의 방향으로 $q$만큼 평행이동한 것이다.\n(1-1) $q>0$이면 $y$ 축의 양의 방향(위쪽)으로 평행이동\n(1-2) $q<0$이면 $y$ 축의 음의 방향(아래쪽)으로 평행이동\n(2) 꼭짓점의 좌표: $(0, q)$\n(3) 축의 방정식: $x=0$ ($y$ 축)","{'id': '525', 'name': '이차함수 > 이차함수와 그래프 > 이차함수 y=a(x-p)^2+q의 그래프'}","{'id': '135', 'name': '이차함수의 의미를 이해하고, 그 그래프를 그릴 수 있다.'}",16,16,0.21333333333333335
1251,이차함수 $y=a(x-p)^2$의 그래프의 성질,중등-중3-1학기,"(1) 이차함수 $y=ax^2$의 그래프를 $x$ 축의 방향으로 $p$만큼 평행이동한 것이다.\n(1-1) $p>0$이면 $x$ 축의 양의 방향(오른쪽)으로 평행이동\n(1-2) $p<0$이면 $x$ 축의 음의 방향(왼쪽)으로 평행이동\n(2) 꼭짓점의 좌표: $(p, 0)$\n(3) 축의 방정식: $x=p$","{'id': '525', 'name': '이차함수 > 이차함수와 그래프 > 이차함수 y=a(x-p)^2+q의 그래프'}","{'id': '135', 'name': '이차함수의 의미를 이해하고, 그 그래프를 그릴 수 있다.'}",17,16,0.22666666666666666
1252,이차함수 $y=a(x-p)^2+q$의 그래프의 성질,중등-중3-1학기,"(1) 이차함수 $y=ax^2$의 그래프를 $x$ 축의 방향으로 $p$만큼, $y$ 축의 방향으로 $q$만큼 평행이동한 것이다.\n(2) 꼭짓점의 좌표 : $(p, q)$\n(3) 축의 방정식 : $x=p$","{'id': '525', 'name': '이차함수 > 이차함수와 그래프 > 이차함수 y=a(x-p)^2+q의 그래프'}","{'id': '135', 'name': '이차함수의 의미를 이해하고, 그 그래프를 그릴 수 있다.'}",18,16,0.24
1253,이차함수 $y=ax^2+bx+c$의 그래프,중등-중3-1학기,"이차함수 $y=ax^2+bx+c$의 그래프는 $y=a(x-p)^2+ q$ 꼴로 고쳐서 그릴 수 있다. \n→ $y=ax^2+bx+c=a(x+\frac{b}{2a})^2-\frac{b^2-4ac}{4a}$\n(1) 축의 방정식\n: $x=-\frac{b}{2a}$\n(2) 꼭짓점의 좌표\n: ($-\frac{b}{2a}$, $-\frac{b^2-4ac}{4a}$)\n(3) $y$ 축과의 교점의 좌표\n: (0,c)","{'id': '526', 'name': '이차함수 > 이차함수와 그래프 > 이차함수 y=ax^2+bx+c의 그래프'}","{'id': '135', 'name': '이차함수의 의미를 이해하고, 그 그래프를 그릴 수 있다.'}",19,16,0.25333333333333335
1254,"이차함수 $y=ax^2+bx+c$의 그래프와 $a$, $b$, $c$의 부호",중등-중3-1학기,"이차함수 $y=ax^2+bx+c$의 그래프가 주어졌을 때 a, b, c의 부호는 다음과 같이 결정된다. \n(1) a의 부호\n: 그래프의 모양으로 결정\n(1-1) 아래로 볼록 → $a>0$\n(1-2) 위로 볼록 →  $a<0$\n\n(2) b의 부호\n: 축의 위치로 결정\n(2-1) 축이 $y$ 축의 왼쪽에 위치 →  a, b는 같은 부호 ($ab>0$)\n(2-2) 축이 $y$ 축과 일치 →  $b=0$ \n(2-3) 축이 $y$ 축의 오른쪽에 위치 → a, b는 다른 부호 ($ab<0$)\n\n(3) c의 부호\n: $y$ 축과의 교점의 위치로 결정\n(3-1) $y$ 축과의 교점이 원점의 위쪽에 위치\n→ $c>0$\n(3-2) $y$ 축과의 교점이 원점과 일치 → $c=0$\n(3-3) $y$ 축과의 교점이 원점의 아래쪽에 위치 → $c<0$","{'id': '526', 'name': '이차함수 > 이차함수와 그래프 > 이차함수 y=ax^2+bx+c의 그래프'}","{'id': '136', 'name': '이차함수의 그래프의 성질을 이해한다.'}",20,16,0.26666666666666666
4209,제곱근표,중등-중3-1학기,(1) 제곱근표 \n: 1.00부터 99.9까지의 수의 양의 제곱근의 값을 반올림하여 소수점 아래 셋째 자리까지 나타낸 것\n\n(2) 제곱근표 읽는 방법 \n: 제곱근표에서 처음 두자릿수의 가로줄과 끝자릿수의 세로줄이 만나는 곳에 적힌 수를 읽는다.,"{'id': '511', 'name': '제곱근과 실수 > 제곱근과 실수 > 제곱근의 성질'}","{'id': '38', 'name': '제곱근의 뜻을 알고, 그 성질을 이해한다.'}",21,16,0.28
4210,근호를 포함한 식의 혼합 계산,중등-중3-1학기,"(1) 괄호가 있으면 분배법칙을 이용하여 괄호를 푼다.\n(2) 근호 안에 제곱인 인수가 있으면 근호 밖으로 꺼낸다.\n(3) 분모에 무리수가 있으면 분모를 유리화한다.\n(4) 곱셈, 나눗셈을 먼저 한 후 덧셈, 뺄셈을 한다.","{'id': '515', 'name': '제곱근과 실수 > 근호를 포함한 식의 계산 > 근호를 포함한 식의 덧셈과 뺄셈'}","{'id': '41', 'name': '근호를 포함한 식의 사칙 계산을 할 수 있다.'}",22,16,0.29333333333333333
4211,뺄셈을 이용한 실수의 대소 관계,중등-중3-1학기,"두 실수 a, b의 대소 관계는 $a-b$의 값의 부호에 따라 다음과 같이 정해진다. \n(1) $a-b>0$이면 $a>b$\n(2) $a-b=0$이면 $a=b$\n(3) $a-b<0$이면 $a<b$","{'id': '515', 'name': '제곱근과 실수 > 근호를 포함한 식의 계산 > 근호를 포함한 식의 덧셈과 뺄셈'}","{'id': '41', 'name': '근호를 포함한 식의 사칙 계산을 할 수 있다.'}",23,16,0.30666666666666664
4212,곱셈 공식을 이용한 수의 제곱의 계산,중등-중3-1학기,"곱셈 공식 $(a+b)^2=a^2+2ab+b^2$, $(a-b)^2=a^2-2ab+b^2$을 이용한다.","{'id': '516', 'name': '다항식의 곱셈과 인수분해 > 다항식의 곱셈 > 다항식의 곱셈'}","{'id': '89', 'name': '다항식의 곱셈을 할 수있다.'}",24,16,0.32
4232,공통인수가 있는 다항식의 인수분해,중등-중3-1학기,공통인수를 모두 묶어 낸 후 인수분해 공식을 이용한다.,"{'id': '518', 'name': '다항식의 곱셈과 인수분해 > 다항식의 인수분해 > 인수분해 공식'}","{'id': '90', 'name': '다항식의 인수분해를 할 수 있다.'}",25,16,0.3333333333333333
4233,수의 계산,중등-중3-1학기,인수분해 공식을 이용할 수 있도록 수의 모양을 변형하여 계산한다.,"{'id': '518', 'name': '다항식의 곱셈과 인수분해 > 다항식의 인수분해 > 인수분해 공식'}","{'id': '90', 'name': '다항식의 인수분해를 할 수 있다.'}",26,16,0.3466666666666667
4234,복잡한 이차방정식을 푸는 방법,중등-중3-1학기,"다음과 같이 식을 정리한 후 인수분해 또는 근의 공식을 이용하여 해를 구한다.\n(1) 괄호가 있으면 전개하여 $ax^2+bx+c=0$의 꼴로 정리한다.\n(2) 계수가 분수 또는 소수이면 양변에 적당한 수를 곱하여 계수를 정수로 고친다.\n(2-1) 계수가 분수이면 양변에 분모의 최소공배수를 곱한다.\n(2-2) 계수가 소수이면 양변에 $10$, $100$, $1000$, …을 곱한다.\n(2-3) 공통부분이 있으면 공통부분을 한 문자로 놓고 정리한다.","{'id': '522', 'name': '이차방정식 > 이차방정식 > 근의공식을 이용한 이차방정식의 풀이'}","{'id': '103', 'name': '이차방정식을 풀 수 있다.'}",27,16,0.36
4236,"꼭짓점의 좌표가 주어질 때, 이차함수의 식을 구하는 방법",중등-중3-1학기,"꼭짓점의 좌표 (○, □)와 그래프 위의 한 점의 좌표가 주어진 이차함수의 식은 다음과 같은 순서로 구한다. \n(1) 이차함수의 식을 $y=a(x-○)^2+□$로 놓는다. \n(2) 그래프 위의 점의 좌표를 대입하여 a의 값을 구한다.","{'id': '526', 'name': '이차함수 > 이차함수와 그래프 > 이차함수 y=ax^2+bx+c의 그래프'}","{'id': '136', 'name': '이차함수의 그래프의 성질을 이해한다.'}",28,16,0.37333333333333335
4697,제곱근의 표현,중등-중3-1학기,"(1) 제곱근은 기호 $\sqrt{\placeholder{}}$를 사용하여 나타내는데 이것을 근호라 하고, '제곱근' 또는 '루트(root)'라 읽는다. \n\n(2) 양수 a의 제곱근 중에서 양수인 것을 양의 제곱근, 음수인 것을 음의 제곱근이라 하고 다음과 같이 나타낸다.\n양의 제곱근 : $\sqrt[]{a}$\n음의 제곱근 : $-\sqrt[]{a}$","{'id': '510', 'name': '제곱근과 실수 > 제곱근과 실수 > 제곱근의 뜻'}","{'id': '38', 'name': '제곱근의 뜻을 알고, 그 성질을 이해한다.'}",29,16,0.38666666666666666
4699,제곱근의 성질,중등-중3-1학기,"(1) 양수 $a$의 제곱근 $\sqrt{a}$와 $-\sqrt{a}$는 제곱하면 $a$가 된다.\n즉, $a>0$일 때, $(\sqrt{a})^2=a$,\n$(-\sqrt{a})^2=a$\n(2) 근호 안의 수가 어떤 수의 제곱이면 근호를 사용하지 않고 나타낼 수 있다.\n즉, $a>0$일 때, $\sqrt{a^2}=a$, $\sqrt{(-a)^2}=a$","{'id': '511', 'name': '제곱근과 실수 > 제곱근과 실수 > 제곱근의 성질'}","{'id': '38', 'name': '제곱근의 뜻을 알고, 그 성질을 이해한다.'}",30,16,0.4
4709,$\sqrt{a^2}$의 성질,중등-중3-1학기,"모든 수 a에 대하여 $\sqrt{a^2}=\mleft|a\mright|=\begin{cases}{a\geq0,}\sqrt[]{a^2}=a \\ {a<0}$,$\sqrt[]{(-a)^2}=a\end{cases}$\n(모든 수 $a$에 대하여 $\sqrt{a^2}$는 \mleft|a\mright|와 같고,  $a$가 $0$보다 크거나 같을 때 $\sqrt{a^2}$은 a이고, $a$가 $0$보다 작을 때 $\sqrt{a^2}$은 $-a$이다.)","{'id': '511', 'name': '제곱근과 실수 > 제곱근과 실수 > 제곱근의 성질'}","{'id': '38', 'name': '제곱근의 뜻을 알고, 그 성질을 이해한다.'}",31,16,0.41333333333333333
4720,제곱수,중등-중3-1학기,"(1) $1$, $4$, $9$, $16$, ... 과 같이 자연수의 제곱인 수를 제곱수라 한다.\n(2) 근호 안의 수가 제곱수이면 근호를 없애고 자연수로 나타낼 수 있다.\n즉, $\sqrt{(제곱수)}=\sqrt{(자연수)^2}=(자연수)$\n(3) 모든 자연수는 근호를 사용하여 $\sqrt{(제곱수)}$의 꼴로 나타낼 수 있다.","{'id': '511', 'name': '제곱근과 실수 > 제곱근과 실수 > 제곱근의 성질'}","{'id': '38', 'name': '제곱근의 뜻을 알고, 그 성질을 이해한다.'}",32,16,0.4266666666666667
4723,제곱근의 대소 관계,중등-중3-1학기,"$a>0$, $b>0$일 때, 다음이 성립한다.\n(1) $a<b$이면 $\sqrt{a}<\sqrt{b}$\n(2) $\sqrt{a}<\sqrt{b}$이면 $a<b$","{'id': '511', 'name': '제곱근과 실수 > 제곱근과 실수 > 제곱근의 성질'}","{'id': '38', 'name': '제곱근의 뜻을 알고, 그 성질을 이해한다.'}",33,16,0.44
4724,무리수,중등-중3-1학기,"(1) 무리수: 유리수가 아닌 수, 즉 순환소수가 아닌 무한소수로 나타내어지는 수\n(2) 소수의 분류\n소수는 유한소수와 무한소수로 분류되고, 무한소수는 순환소수와 순환소수가 아닌 무한소수로 분류할 수 있다. 여기서 유한소수와 순환소수는 유리수이고, 순환소수가 아닌 무한소수를 무리수라고 한다.","{'id': '512', 'name': '제곱근과 실수 > 제곱근과 실수 > 무리수와 실수'}","{'id': '39', 'name': '무리수의 개념을 이해한다.'}",34,16,0.4533333333333333
4725,실수,중등-중3-1학기,"(1) 실수 : 유리수와 무리수를 통틀어 실수라고 한다.\n(2) 실수의 분류 : 실수는 유리수와 무리수(순환소수가 아닌 무한소수)로 분류된다. 다시 유리수는 정수와 정수가 아닌 유리수로 분류된다. 다시 정수는 양의 정수(자연수) , $0$, 음의 정수로 분류된다.","{'id': '512', 'name': '제곱근과 실수 > 제곱근과 실수 > 무리수와 실수'}","{'id': '39', 'name': '무리수의 개념을 이해한다.'}",35,16,0.4666666666666667
5141,무리수를 수직선 위에 나타내기,중등-중3-1학기,직각삼각형의 빗변의 길이를 이용하여 무리수를 수직선 위에 나타낼 수 있다.,"{'id': '512', 'name': '제곱근과 실수 > 제곱근과 실수 > 무리수와 실수'}","{'id': '39', 'name': '무리수의 개념을 이해한다.'}",36,16,0.48
5142,실수의 대소 관계,중등-중3-1학기,"(1) 실수를 수직선 위에 나타내면 양의 실수는 원점의 오른쪽에, 음의 실수는 원점의 왼쪽에 나타난다.\n(2) 두 실수 $a$, $b$의 대소 관계는 $a-b$의 값의 부호에 따라 다음과 같이 정한다.\n(2-1) $a-b>0$이면 $a>b$\n(2-2) $a-b=0$이면 $a=b$\n(2-3) $a-b<0$이면 $a<b$","{'id': '513', 'name': '제곱근과 실수 > 제곱근과 실수 > 실수의 대소 관계'}","{'id': '40', 'name': '실수의 대소 관계를 판단 할 수 있다.'}",37,16,0.49333333333333335
5261,제곱근의 곱셈,중등-중3-1학기,"$a>0$, $b>0$이고 $m$, $n$이 유리수일 때\n(1) $\sqrt{a}\times\sqrt{b}=\sqrt{a}\sqrt{b}=\sqrt{ab}$\n(2) $m\sqrt{a}\times n\sqrt{b}=mn\sqrt{ab}$","{'id': '514', 'name': '제곱근과 실수 > 근호를 포함한 식의 계산 > 근호를 포함한 식의 곱셈과 나눗셈'}","{'id': '38', 'name': '제곱근의 뜻을 알고, 그 성질을 이해한다.'}",38,16,0.5066666666666667
5308,근호가 있는 식의 변형,중등-중3-1학기,"(1) 근호 안의 제곱인 인수는 근호 밖으로 꺼낼 수 있다.\n$\sqrt{a^2b}=a\sqrt{b}$, $\sqrt{\frac{b}{a^2}}=\frac{\sqrt[]{b}}{a}$ (단, $a>0$, $b>0$)\n(2) 근호 밖의 양수는 제곱하여 근호 안으로 넣을 수 있다.\n$a\sqrt{b}=\sqrt{a^2b}$, $\frac{\sqrt[]{b}}{a}=\sqrt{\frac{b}{a^2}}$ (단, $a>0$, $b>0$)","{'id': '514', 'name': '제곱근과 실수 > 근호를 포함한 식의 계산 > 근호를 포함한 식의 곱셈과 나눗셈'}","{'id': '41', 'name': '근호를 포함한 식의 사칙 계산을 할 수 있다.'}",39,16,0.52
5317,분모의 유리화,중등-중3-1학기,"분모의 유리화란 분모가 근호를 포함한 무리수일 때, 분모와 분자에 $0$이 아닌 같은 수를 곱하여 분모를 유리수로 고치는 것이다.","{'id': '514', 'name': '제곱근과 실수 > 근호를 포함한 식의 계산 > 근호를 포함한 식의 곱셈과 나눗셈'}","{'id': '41', 'name': '근호를 포함한 식의 사칙 계산을 할 수 있다.'}",40,16,0.5333333333333333
5595,제곱근의 덧셈과 뺄셈,중등-중3-1학기,"제곱근의 덧셈과 뺄셈은 근호 안의 수가 같은 것끼리 계산한다. \nm, n은 유리수이고 $\sqrt[]{a}$는 무리수일 때, \n(1) $m\sqrt[]{a}+n\sqrt[]{a}=(m+n)\sqrt[]{a}$\n(2) $m\sqrt[]{a}-n\sqrt[]{a}=(m-n)\sqrt[]{a}$\n\n*참고\n(1) 근호 안의 수가 $a^2b$꼴이면 $a\sqrt[]{b}$꼴로 변형한 후 계산한다. \n(2) 분모가 근호를 포함한 무리수이면 분모를 유리화한 후 계산한다.","{'id': '515', 'name': '제곱근과 실수 > 근호를 포함한 식의 계산 > 근호를 포함한 식의 덧셈과 뺄셈'}","{'id': '41', 'name': '근호를 포함한 식의 사칙 계산을 할 수 있다.'}",41,16,0.5466666666666666
5596,근호를 포함한 식의 분배법칙,중등-중3-1학기,"근호를 포함한 식에서도 유리수와 마찬가지로 분배법칙이 성립한다.\n$a>0$, $b>0$, $c>0$일 때\n(1) $\sqrt[]{a}(\sqrt[]{b}\pm\sqrt[]{c})=\sqrt[]{a}\sqrt[]{b}\pm\sqrt[]{a}\sqrt[]{c}=\sqrt[]{ab}\pm\sqrt[]{ac}$ (복부호 동순)\n(2) $(\sqrt[]{a}\pm\sqrt[]{b})\sqrt[]{c}=\sqrt[]{a}\sqrt[]{c}\pm\sqrt[]{b}\sqrt[]{c}=\sqrt[]{ac}\pm\sqrt[]{bc}$ (복부호 동순)","{'id': '515', 'name': '제곱근과 실수 > 근호를 포함한 식의 계산 > 근호를 포함한 식의 덧셈과 뺄셈'}","{'id': '41', 'name': '근호를 포함한 식의 사칙 계산을 할 수 있다.'}",42,16,0.56
5921,무리수를 정수 부분과 소수 부분으로 나누는 방법,중등-중3-1학기,무리수는 순환소수가 아닌 무한소수로 나타내어지는 수이므로 정수 부분과 소수 부분으로 나눌 수 있다. 이때 소수 부분은 정확한 값을 알기 어려우므로 다음과 같이 무리수에서 정수 부분을 뺀 식으로 나타낸다.\n$(무리수)=(정수 부분)+(소수 부분)$ 이면 $(소수 부분)=(무리수)-(정수 부분)$,"{'id': '512', 'name': '제곱근과 실수 > 제곱근과 실수 > 무리수와 실수'}","{'id': '39', 'name': '무리수의 개념을 이해한다.'}",43,16,0.5733333333333334
9728,제곱근의 나눗셈,중등-중3-1학기,"근호 안의 수끼리, 근호 밖이 수끼리 나눈다.\n$a>0,b>0$이고, m, m이 유리수일 때,\n(1) $\sqrt[]{a}\div\sqrt[]{b}=\frac{\sqrt[]{a}}{\sqrt[]{b}}=\sqrt[]{\frac{a}{b}}$\n(2) $m\sqrt[]{a}\div n\sqrt[]{b}=\frac{m}{n}\sqrt[]{\frac{a}{b}}$ (단, $ne0$)","{'id': '514', 'name': '제곱근과 실수 > 근호를 포함한 식의 계산 > 근호를 포함한 식의 곱셈과 나눗셈'}","{'id': '41', 'name': '근호를 포함한 식의 사칙 계산을 할 수 있다.'}",44,16,0.5866666666666667
9743,곱셈 공식을 이용한 두 수의 곱의 계산,중등-중3-1학기,"곱셈 공식 $(a+b)(a-b)=a^2-b^2$, $(x+a)(x+b)=x^2+(a+b)x+ab$을 이용한다.","{'id': '516', 'name': '다항식의 곱셈과 인수분해 > 다항식의 곱셈 > 다항식의 곱셈'}","{'id': '89', 'name': '다항식의 곱셈을 할 수 있다.'}",45,16,0.6
9745,곱셈 공식을 이용한 근호를 포함한 식의 분모의 유리화,중등-중3-1학기,"분모가 $2$개의 항으로 되어 있는 무리수일 때는 곱셈 공식 $(a+b)(a-b)=a^2-b^2$을 이용하여 분모를 유리화한다.\n$\frac{c}{\sqrt[]{a}+\sqrt[]{b}}=\frac{c(\sqrt[]{a}-\sqrt[]{b})}{(\sqrt[]{a}+\sqrt[]{b})^{}(\sqrt[]{a}-\sqrt[]{b})^{}}=\frac{c(\sqrt[]{a}-\sqrt[]{b})}{(\sqrt[]{a})^2-(\sqrt[]{b})^2}=\frac{c(\sqrt[]{a}-\sqrt[]{b})}{a-b}$ (단, $a>0$, $b>0$, $a\ne b$)","{'id': '516', 'name': '다항식의 곱셈과 인수분해 > 다항식의 곱셈 > 다항식의 곱셈'}","{'id': '89', 'name': '다항식의 곱셈을 할 수 있다.'}",46,16,0.6133333333333333
9811,완전제곱식,중등-중3-1학기,다항식의 제곱으로 된 식 또는 이 식에 상수를 곱한 식을 완전제곱식이라고 한다.,"{'id': '518', 'name': '다항식의 곱셈과 인수분해 > 다항식의 인수분해 > 인수분해 공식'}","{'id': '90', 'name': '다항식의 인수분해를 할 수 있다.'}",47,16,0.6266666666666667
9812,$a^2-b^2$의 인수분해방법,중등-중3-1학기,$a^2-b^2=(a+b)(a-b)$,"{'id': '518', 'name': '다항식의 곱셈과 인수분해 > 다항식의 인수분해 > 인수분해 공식'}","{'id': '90', 'name': '다항식의 인수분해를 할 수 있다.'}",48,16,0.64
9829,공통부분이 있는 다항식의 인수분해,중등-중3-1학기,공통부분을 한 문자로 치환한 후 인수분해 공식을 이용한다.,"{'id': '518', 'name': '다항식의 곱셈과 인수분해 > 다항식의 인수분해 > 인수분해 공식'}","{'id': '90', 'name': '다항식의 인수분해를 할 수 있다.'}",49,16,0.6533333333333333
9831,식의 값,중등-중3-1학기,주어진 식을 인수분해한 후 문자에 수를 대입하여 식의 값을 구한다.,"{'id': '518', 'name': '다항식의 곱셈과 인수분해 > 다항식의 인수분해 > 인수분해 공식'}","{'id': '90', 'name': '다항식의 인수분해를 할 수 있다.'}",50,16,0.6666666666666666
9832,인수분해를 이용한 이차방정식의 풀이,중등-중3-1학기,인수분해를 이용하여 이차방정식의 해를 구할 때는 다음과 같은 순서로 푼다. \n(1) 주어진 이차방정식을 정리한다. \n- $ax^2+bx+c=0$\n(2) 좌변을 인수분해한다. \n- $a(x-\alpha)(x-\beta)=0$\n(3) $AB=0$의 성질을 이용한다. \n- $x-\alpha=0$ 또는 $x-\beta=0$\n(4) 해를 구한다. \n- $x=\alpha$ 또는 $x=\beta$,"{'id': '520', 'name': '이차방정식 > 이차방정식 > 인수분해를 이용한 이차방정식의 풀이'}","{'id': '103', 'name': '이차방정식을 풀 수 있다.'}",51,16,0.68
9846,계수가 유리수인 이차방정식의 근,중등-중3-1학기,"유리수 a, b, c에 대하여 이차방정식 $ax^2+bx+c=0$의 한 근이 $p+q\sqrt[]{m}$이면 다른 한 근은 $p-q\sqrt[]{m}$이다. (단, p, q는 유리수, $\sqrt[]{m}$는 무리수이다. )","{'id': '522', 'name': '이차방정식 > 이차방정식 > 근의 공식을 이용한 이차방정식의 풀이'}","{'id': '104', 'name': '이차방정식을 활용하여 문제를 해결할 수 있다.'}",52,16,0.6933333333333334
9852,포물선,중등-중3-1학기,"이차함수 $y=ax^2$의 그래프와 같은 모양의 곡선을 포물선이라 한다. \n(1) 포물선은 선대칭도형이며 그 대칭축을 포물선의 축이라 한다. \n(2) 포물선과 축의 교점을 포물선의 꼭짓점이라 한다. \n\n참고)\n: 이차함수 $y=ax^2$의 그래프는 원점을 꼭짓점으로 하고, y축을 축으로 하는 포물선이다.","{'id': '524', 'name': '이차함수 > 이차함수와 그래프 > 이차함수 y=ax^2의 그래프'}","{'id': '135', 'name': '이차함수의 의미를 이해하고, 그 그래프를 그릴 수 있다.'}",53,16,0.7066666666666667
9856,"이차함수의 그래프와 x절편, y절편",중등-중3-1학기,"(1) x절편 \n: $y=0$일 때, x의 값을 구한다. \n(2) y절편\n: $x=0$일 때, y의 값을 구한다.","{'id': '526', 'name': '이차함수 > 이차함수와 그래프 > 이차함수 y=ax^2+bx+c의 그래프'}","{'id': '135', 'name': '이차함수의 의미를 이해하고, 그 그래프를 그릴 수 있다.'}",54,16,0.72
10168,인수분해 공식(1); 완전제곱식이 될 조건,중등-중3-1학기,(1) $x^2+ax+b$가 완전제곱식이 되도록 하는 b의 조건 : $b=(\frac{a}{2})^2$\n(2) $x^2+ax+b$가 완전제곱식이 되도록 하는 a의 조건 : $a=\pm2\sqrt[]{b}$,"{'id': '518', 'name': '다항식의 곱셈과 인수분해 > 다항식의 인수분해 > 인수분해 공식'}","{'id': '90', 'name': '다항식의 인수분해를 할 수 있다.'}",55,16,0.7333333333333333
10169,인수분해,중등-중3-1학기,인수분해 \n: 하나의 다항식을 두 개 이상의 인수의 곱을 나타내는 것을 다항식을 인수분해한다고 한다.,"{'id': '518', 'name': '다항식의 곱셈과 인수분해 > 다항식의 인수분해 > 인수분해 공식'}","{'id': '90', 'name': '다항식의 인수분해를 할 수 있다.'}",56,16,0.7466666666666667
10170,공통인수를 이용한 인수분해,중등-중3-1학기,공통인수를 이용한 인수분해 \n: 다항식의 각 항에 공통인수가 있으면 그 인수로 묶어 내어 인수분해 할 수 있다.,"{'id': '518', 'name': '다항식의 곱셈과 인수분해 > 다항식의 인수분해 > 인수분해 공식'}","{'id': '90', 'name': '다항식의 인수분해를 할 수 있다.'}",57,16,0.76
10174,$a$의 제곱근과 제곱근 $a$,중등-중3-1학기,"(1) a의 제곱근: 제곱하여 a가 되는 수, $\sqrt[]{a}$, $-\sqrt[]{a}$\n(2) 제곱근 a : a의 양의 제곱근, $\sqrt[]{a}$","{'id': '510', 'name': '제곱근과 실수 > 제곱근과 실수 > 제곱근의 뜻'}","{'id': '38', 'name': '제곱근의 뜻을 알고, 그 성질을 이해한다.'}",58,16,0.7733333333333333
10180,이차방정식의 근의 공식:  $ax^2+{2b}^{\prime}x+c=0$,중등-중3-1학기,"다음과 같이 이차방정식의 근을 구하는 공식을 이차방정식의 근의 공식이라 한다. \n: x의 계수가 짝수인 이차방정식 $ax^2+{2b}^{\prime}x+c=0$의 근은 $x=\frac{-{b}^{\prime}\pm\sqrt[]{{b}^{\prime}^2-ac}}{a}$ (단, ${b}^{\prime2}-ac\ge0$)","{'id': '522', 'name': '이차방정식 > 이차방정식 > 근의 공식을 이용한 이차방정식의 풀이'}","{'id': '103', 'name': '이차방정식을 풀 수 있다.'}",59,16,0.7866666666666666
10181,이차방정식이 중근을 가질 조건,중등-중3-1학기,"(1) 이차방정식을 인수분해했을 때, $(완전제곱식)=0$의 꼴로 나타내어지면 이 이차방정식은 중근을 갖는다.\n(2) 이차방정식 $x^2+ax+b=0$이 중근을 가지려면 $b=(\frac{a}{2})^2$이어야 한다.","{'id': '520', 'name': '이차방정식 > 이차방정식 > 인수분해를 이용한 이차방정식의 풀이'}","{'id': '103', 'name': '이차방정식을 풀 수 있다.'}",60,16,0.8
10182,이차방정식의 해(근),중등-중3-1학기,$x$에 대한 이차방정식을 참이 되게 하는 $x$의 값\n$x$에 대한 이차방정식을 참이 되게 하는 $x$의 값,"{'id': '519', 'name': '이차방정식 > 이차방정식 > 이차방정식의 뜻'}","{'id': '103', 'name': '이차방정식을 풀 수 있다.'}",61,16,0.8133333333333334
10183,이차방정식을 푼다,중등-중3-1학기,이차방정식을 푼다\n: 이차방정식의 해를 모두 구하는 것,"{'id': '519', 'name': '이차방정식 > 이차방정식 > 이차방정식의 뜻'}","{'id': '103', 'name': '이차방정식을 풀 수 있다.'}",62,16,0.8266666666666667
10590,항이 $4$개인 식의 인수분해방법,중등-중3-1학기,(1) 공통인 인수가 생기도록 $(2개의 항)+(2개의 항)$으로 묶는다.\n(2) $A^2-B^2$꼴이 되도록 $(3개의 항)+(1개의 항)$ 또는 $(1개의 항)+(3개의 항)$으로 묶는다.,"{'id': '517', 'name': '다항식의 곱셈과 인수분해 > 다항식의 인수분해 > 다항식의 인수분해'}","{'id': '90', 'name': '다항식의 인수분해를 할 수 있다.'}",63,16,0.84
