id,name,semester,description,chapter,achievement,group_count,group_pos_x,group_pos_y
6836,조화수열,고등-수1-전체,"수열$\lbrace a_n \rbrace$에 대하여 각 항의 역수로 이루어진 수열 $\lbrace\frac{1}{a_n}\rbrace$이 등차수열을 이룰 때, 수열 $\lbrace a_n \rbrace$을 조화수열이라 한다.\n수열$\lbrace a_n \rbrace$이 조화수열이다. $\Leftrightarrow$ 수열 $\lbrace \frac{1}{a_n} \rbrace$이 등차수열이다.","{'id': '602', 'name': '수열 > 등차수열과 등비수열 > 등차수열'}","{'id': '381', 'name': '등차수열의 뜻을 알고, 일반항을 구할 수 있다.'}",73,20,0.7525773195876289
6837,조화중항,고등-수1-전체,"0이 아닌 세 수 a,b,c가 이 순서로 조화수열을 이룰 때, $b$를 $a$와$c$의 조화중항이라 한다. 이때 $\frac{1}{a},\frac{1}{b},\frac{1}{c}$은 이 순서로 등차수열을 이루므로 다음이 성립한다.\n$b$가 $a$와 $c$의 조화중항이다. $\Leftrightarrow \frac{1}{b}$은 $\frac{1}{a}$과 $\frac{1}{c}$의 등차중항이다. \n$\Leftrightarrow \frac{2}{b}=\frac{1}{a}+\frac{1}{c} \Leftrightarrow \frac{2ac}{a+c}$","{'id': '602', 'name': '수열 > 등차수열과 등비수열 > 등차수열'}","{'id': '381', 'name': '등차수열의 뜻을 알고, 일반항을 구할 수 있다.'}",74,20,0.7628865979381443
6838,조화수열의 관계식,고등-수1-전체,"수열 $\lbrace a_n \rbrace$이 조화수열이면 연속하는 세 항 $a_n, a_{n+1}, a_{n+2}$ 사이에 다음 관계가 성립한다.\n$\frac{2}{a_{n+1}}=\frac{1}{a_n}+\frac{1}{a_{n+2}} (단, n=1,2,3,\cdots)$","{'id': '602', 'name': '수열 > 등차수열과 등비수열 > 등차수열'}","{'id': '381', 'name': '등차수열의 뜻을 알고, 일반항을 구할 수 있다.'}",75,20,0.7731958762886598
6839,등차수열의 합,고등-수1-전체,"등차수열의 첫째항부터 제$n$항까지의 합 $S_n$은 다음과 같다.\n(1) 첫째항이 $a$, 제 $n$항이 $l$일 때, $S_n=\frac{n(a+l)}{2}$\n(2) 첫째항이 $a$, 공차가 $d$일 때, $S_n=\frac{n{2a+(n-1)d}}{2}$","{'id': '602', 'name': '수열 > 등차수열과 등비수열 > 등차수열'}","{'id': '382', 'name': '등차수열의 첫째항부터 제 n 항까지의 합을 구할 수 있다.'}",76,20,0.7835051546391752
6840,수열의 합과 일반항 사이의 관계,고등-수1-전체,"수열 ${a_n}$의 첫째항부터 제$n$항까지의 합을 $S_n$이라 하면 다음이 성립한다.\n$a_1=S_1, a_n=S_n-S_{n-1} (n\geq 2)$","{'id': '602', 'name': '수열 > 등차수열과 등비수열 > 등차수열'}","{'id': '382', 'name': '등차수열의 첫째항부터 제 n 항까지의 합을 구할 수 있다.'}",77,20,0.7938144329896907
6870,등비수열,고등-수1-전체,첫째항부터 차례로 일정한 수를 곱하여 만든 수열을 등비수열이라 한다.,"{'id': '603', 'name': '수열 > 등차수열과 등비수열 > 등비수열'}","{'id': '383', 'name': '등비수열의 뜻을 알고, 일반항을 구할 수 있다.'}",78,20,0.8041237113402062
6873,등비수열의 일반항,고등-수1-전체,"첫째항이 $a$, 공비가 $r$인 등비수열의 일반항 $a_n$은 다음과 같다.\n$a_n=ar^{n-1} (단, n=1,2,3,\cdots)$","{'id': '603', 'name': '수열 > 등차수열과 등비수열 > 등비수열'}","{'id': '383', 'name': '등비수열의 뜻을 알고, 일반항을 구할 수 있다.'}",79,20,0.8144329896907216
6875,등비수열의 합,고등-수1-전체,"첫째항이 $a$, 공비가 $r$인 등비수열의 첫째항부터 제 $n$항까지의 합 $S_n$은 다음과 같다.\n(1) $r=1$일 때, $S-n=\frac{a(1-r^n)}{1-r}=\frac{a(r^n-1)}{r-1}$\n(2) $r=1$일 때, $S_n=na$","{'id': '603', 'name': '수열 > 등차수열과 등비수열 > 등비수열'}","{'id': '384', 'name': '등비수열의 첫째항부터 제 n 항까지의 합을 구할 수 있다.'}",80,20,0.8247422680412371
6876,등비수열의 합의 활용-원리합계,고등-수1-전체,"*원리합계\n원금과 이자를 합한 금액을 원리합계라 하는데, 다음의 두 가지 방법으로 구한다.\n(1) 단리법: 원금에 대해서만 이자를 계산하는 방법\n-> 원금 $a$원을 연이율 $r$로 $n$년 동안 단리로 예금할 때의 원리합계 $S$는\n$S=a(1+rn)$(원)\n(2) 복리법: 원금에 이자를 합한 금액을 다시 원금으로 보고 이자를 계산하는 방법\n-> 원금 $a$원을 연이율 $r$로 $n$년동안 1년마다 복리로 예금할 때의 원리합계 $S$는 \n$S=a(1+r)^n$(원)","{'id': '603', 'name': '수열 > 등차수열과 등비수열 > 등비수열'}","{'id': '384', 'name': '등비수열의 첫째항부터 제 n 항까지의 합을 구할 수 있다.'}",81,20,0.8350515463917526
6877,기호 $\sum $,고등-수1-전체,수열 ${a_n}$\n의 첫째항부터 제 $n$항까지의 합을 기호 $\sum $를 사용하여 다음과 같이 나타낸다.\n$a_1+a_2+a_3+\cdots+a_n=\sum ^n_{k\mathop{=}1}a_k$,"{'id': '604', 'name': '수열 > 수열의 합 > 기호 ∑의 뜻과 성질'}","{'id': '385', 'name': 'SIGMA 의 뜻을 알고, 그 성질을 이해하고, 이를 활용할 수 있다.'}",82,20,0.845360824742268
6878,$\sum $의 성질,고등-수1-전체,"기호 $\sum $에 대하여 다음 성질이 성립한다.\n(1) $\sum^n_{k\mathop=1}(a_k+b_k)=\sum^n_{k\mathop=1}{a_k}+\sum^n_{k\mathop=1}{b_k} $\n(2) $\sum^n_{k\mathop=1}(a_k-b_k)=\sum^n_{k\mathop=1}{a_k}-\sum^n_{k\mathop=1}{b_k}$\n(3) $\sum^n_{k\mathop=1}{ca_k}=c\sum^n_{k\mathop=1}{a_k}$ (단, $c$는 상수)\n(4) $\sum^n_{k\mathop=1}c=cn$ (단, $c$는 상수)","{'id': '604', 'name': '수열 > 수열의 합 > 기호 ∑의 뜻과 성질'}","{'id': '385', 'name': 'SIGMA 의 뜻을 알고, 그 성질을 이해하고, 이를 활용할 수 있다.'}",83,20,0.8556701030927835
6879,자연수의 거듭제곱의 합,고등-수1-전체,자연수의 거듭제곱의 합은 다음과 같다.\n(1) $\sum^n_{k\mathop=1}k=1+2+3+\cdots+n=\frac{n(n+1)}{2}$\n(2) $\sum^n_{k\mathop=1}k^2=1^2+2^2+3^2+\cdots+n^2=\frac{n(n+1)(2n+1)}{6}$\n(3) $\sum^n_{k\mathop=1}k^3=1^3+2^3+3^3+\cdots+n^3=(\frac{n(n+1)}{2})^2$,"{'id': '605', 'name': '수열 > 수열의 합 > 여러 가지 수열의 합'}","{'id': '386', 'name': '여러가지 수열의 첫째항부터 제 n 항까지의 합을 구할 수 있다.'}",84,20,0.865979381443299
7001,분수 꼴로 주어진 수열의 합,고등-수1-전체,분수 꼴로 주어진 수열은 다음과 같이 부분분수로 변형한 후 전개하면 쉽게 계산되는 경우가 많다.\n(1) $\sum^n_{k\mathop=1}\frac{1}{k(k+1)}=\sum^n_{k\mathop=1}(\frac{1}{k}-\frac{1}{k+1})$\n(2) $\sum^n_{k\mathop=1}\frac{1}{k(k+a)}=\frac{1}{a}\sum^n_{k\mathop=1}(\frac{1}{k}-\frac{1}{k+a})$\n(3) $\sum^n_{k\mathop=1}\frac{1}{(k+a)(k+b)}=\frac{1}{b-a}\sum^n_{k\mathop=1}(\frac{1}{k+a}-\frac{1}{k+b})$\n(4) $\sum^n_{k\mathop=1}\frac{1}{k(k+1)(k+2)}=\frac{1}{2}\sum^n_{k\mathop=1}(\frac{1}{k(k+1)}-\frac{1}{(k+1)(k+2)})$,"{'id': '605', 'name': '수열 > 수열의 합 > 여러 가지 수열의 합'}","{'id': '386', 'name': '여러가지 수열의 첫째항부터 제 n 항까지의 합을 구할 수 있다.'}",85,20,0.8762886597938144
7029,분모에 근호가 있는 수열의 합,고등-수1-전체,"$\sum^n_{k\mathop=1}{\frac{1}{\sqrt{k+1}+\sqrt{k}}}$을 계산해보자.\n$\frac{1}{\sqrt{k+1}+\sqrt{k}}$의 분모를 유리화하면 $\sqrt{k+1}-\sqrt{k}$\n따라서 $\sqrt{k+1}-\sqrt{k}$의 $k$에 $1,2,3,\cdots,n$을 차례로 대입하여 합의 꼴로 나타내면 다음과 같이 항이 연쇄적으로 소거되므로 $\sum^n_{k\mathop=1}{\frac{1}{\sqrt{k+1}+\sqrt{k}}}$을 계산 할 수 있다.\n$\sum^n_{k\mathop=1}{\frac{1}{\sqrt{k+1}+\sqrt{k}}}=\sum^n_{k\mathop=1}{\sqrt{k+1}-\sqrt{k}}\n=$(\sqrt{2}-\sqrt{1})+(\sqrt{3}-\sqrt{2})+(\sqrt{4}-\sqrt{3})+\cdots+(\sqrt{n+1}-\sqrt{n})\n=\sqrt{n+1}-1$\n이와 같이 분모에 근호가 있는 수열의 합은 다음 순서로 구한다.\n(1) 일반항 ${a_k}$의 분모를 유리화 한다.\n(2) ${a_k}$의 $k$에 $1,2,3,\cdots,n$을 차례로 대입하여 합의 꼴로 나타낸다.\n(3) 더하여 0이 되는 항을 소거한다.","{'id': '605', 'name': '수열 > 수열의 합 > 여러 가지 수열의 합'}","{'id': '386', 'name': '여러가지 수열의 첫째항부터 제 n 항까지의 합을 구할 수 있다.'}",86,20,0.8865979381443299
7068,군수열,고등-수1-전체,"수열의 항을 몇 개씩 묶었을 때, 규칙성을 갖는 수열에 대하여 알아보자.\n예를 들어 수열 1,1,2,1,2,3,1,2,3,4,1,2,3,4,5,$\cdots$\n에서 항을 1개,2개,3개,$\cdots$ 로 묶으면\n$(1),(1,2),(1,2,3),(1,2,3,4),(1,2,3,4,5),\cdots$\n이때 각 묶음 안의 수열은 첫째항이 1, 공차가 1인 등차수열을 이룬다는 것을 알 수 있다.\n이와 같이 수열의 항을 몇 개씩 묶어 규칙성을 갖는 군으로 나눌 수 있는 수열을 군수열이라 하고, 각 군을 앞에서부터 차례로 제1군, 제2군, 제3군, $\cdots$이라 한다.\n일반적으로 군수열에 대한 문제는 다음 순서로 해결한다.\n(1) 수열의 각 항의 규칙을 파악하여 군으로 묶는다.\n(2) 각 군에 대하여 다음을 파악한다.\n- 각 군의 첫째항 또는 마지막 항이 갖는 규칙성\n- 제$n$군의 항의 개수와 제1군부터 제$n$군까지의 항의 개수\n(3) 구하는 항이 제몇 군의 몇 번째 항인지 구한다.","{'id': '605', 'name': '수열 > 수열의 합 > 여러 가지 수열의 합'}","{'id': '386', 'name': '여러가지 수열의 첫째항부터 제 n 항까지의 합을 구할 수 있다.'}",87,20,0.8969072164948454
7077,수열의 귀납적 정의,고등-수1-전체,"일반적으로 수열$\lbrace a_n\rbrace$을\n(1) 첫째항$a_1$ 또는 처음 몇 개의 항\n(2) 이웃하는 항들 사이의 관계식\n으로 정의하는 것을 수열$\lbrace a_n\rbrace$의 귀납적 정의라 한다.\n이때 (2)의 관계식의 $n$에 1,2,3,$\cdots$을 차례로 대입하면 수열 $\lbrace a_n\rbrace$의 모든 항을 구할 수 있다.","{'id': '606', 'name': '수열 > 수학적 귀납법 > 수열의 귀납적 정의'}","{'id': '387', 'name': '수열의 귀납적 정의를 이해 할 수 있다.'}",88,20,0.9072164948453608
7078,등차수열과 등비수열의 귀납적 정의,고등-수1-전체,"수열$\lbrace a_n\rbrace$에 대하여 $n$=1,2,3, $\cdots$일 때\n(1) $a_{n+1}-a_n=d$ (일정) -> 공차가 $d$인 수열\n(2) $a_{n+1}\div a_n=r$ (일정) -> 공비가 $r$인 등비수열\n(3) $2a_{n+1}=a_n+a_{n+2}$ -> 등차수열\n(4) $a^2_{n+1}=a_na_{n+2}$ -> 등비수열","{'id': '606', 'name': '수열 > 수학적 귀납법 > 수열의 귀납적 정의'}","{'id': '387', 'name': '수열의 귀납적 정의를 이해 할 수 있다.'}",89,20,0.9175257731958762
7094,조화수열을 나타내는 관계식,고등-수1-전체,(1) $\frac{1}{a_{n+1}}-\frac{1}{a_n}=d(일정)\Leftrightarrow \frac{1}{a_{n+1}}=\frac{1}{a_n}+d$\n(2) $\frac{1}{a_{n+1}}-\frac{1}{a_n}=\frac{1}{a_{n+2}}-\frac{1}{a_{n+1}}\Leftrightarrow \frac{2}{a_{n+1}}=\frac{1}{a_n}+\frac{1}{a_{n+2}}\n\Leftrightarrow a_{n+1}=\frac{2a_na_{n+2}}{a_n+a_{n+2}}$,"{'id': '606', 'name': '수열 > 수학적 귀납법 > 수열의 귀납적 정의'}","{'id': '387', 'name': '수열의 귀납적 정의를 이해 할 수 있다.'}",90,20,0.9278350515463918
7141,수학적 귀납법,고등-수1-전체,"자연수 $n$에 대한 명제$p(n)$이 모든 자연수$n$에 대하여 성립함을 증명하려면 다음 두 가지를 보이면 된다.\n(1) $n=1$일 때, 명제 $p(n)$이 성립한다.\n(2) $n=k$일 때 명제 $p(n)$이 성립한다고 가정하면 $n=k+1$일 때에도 명제$p(n)$이 성립한다.\n이와 같은 증명 방법을 수학적 귀납법이라 한다.","{'id': '607', 'name': '수열 > 수학적 귀납법 > 수학적 귀납법'}","{'id': '388', 'name': '수학적 귀납법의 원리를 이해하고, 이를 이용하여 명제를 증명할 수 있다.'}",91,20,0.9381443298969072
9163,지수함수의 그래프의 대칭이동,고등-수1-전체,"지수함수 $y=a^x (a>0,a\ne 1)$ 의 그래프를 \n(1) $x$축에 대하여 대칭이동한 그래프의 식 → $y=-a^x$\n(2) $y$축에 대하여 대칭이동한 그래프의 식 → $y=(\frac{1}{a})^x$\n(3) 원점에 대하여 대칭이동한 그래프의 식 → $y=-(\frac{1}{a})^x$","{'id': '591', 'name': '지수함수와 로그함수 > 지수함수와 로그함수 > 지수함수와 그 그래프'}","{'id': '321', 'name': '지수함수의 뜻을 알고, 지수함수의 그래프를 그릴 수 있으며, 그 성질을 설명할 수 있다.'}",92,20,0.9484536082474226
9182,로그함수의 그래프의 대칭이동,고등-수1-전체,"로그함수 $y=\log_ax(a>0,a\ne 1)$의 그래프를 \n(1) $x$축에 대하여 대칭이동한 그래프의 식 → $y=-\log_ax$\n(2) $y$축에 대하여 대칭이동한 그래프의 식 →$y=\log_a(-x)$\n(3) 원점에 대하여 대칭이동한 그래프의 식 → $y=-\log_a(-x)$\n(4) 직선$y=x$에 대하여 대칭이동한 그래프의 식 → $y=a^x$","{'id': '592', 'name': '지수함수와 로그함수 > 지수함수와 로그함수 > 로그함수와 그 그래프'}","{'id': '322', 'name': '로그함수의 뜻을 알고, 로그함수의 그래프를 그릴 수 있으며, 그 성질을 설명할 수 있다.'}",93,20,0.9587628865979382
9539,등비수열의 합이 될 조건 - 등비수열의 합,고등-수1-전체,"$S_n=Ar^n-A$ ($A$, $r$은 상수)의 꼴이고 $r$이 공비이다.","{'id': '603', 'name': '수열 > 등차수열과 등비수열 > 등비수열'}","{'id': '384', 'name': '등비수열의 첫째항부터 제 n 항까지의 합을 구할 수 있다.'}",94,20,0.9690721649484536
9540,$S_n$이 등비수열의 합이 되기 위한 필요충분조건,고등-수1-전체,$S_n$이 등비수열의 합이 되기 위한 필요충분조건은 $S_n=Ar^n-A$,"{'id': '603', 'name': '수열 > 등차수열과 등비수열 > 등비수열'}","{'id': '384', 'name': '등비수열의 첫째항부터 제 n 항까지의 합을 구할 수 있다.'}",95,20,0.979381443298969
9541,"$S_n=Ar^n+B$ ($A$, $r$, $B$는 상수)를 합으로 갖는 수열 $\lbrace a_n\rbrace$",고등-수1-전체,"$S_n=Ar^n+B$ ($A$, $r$, $B$는 상수)를 합으로 갖는 수열 $\lbrace a_n\rbrace$은 \n(1) $A+B=0$이면 첫째항부터 등비수열\n(2) $A+Be0$이면 제2항부터 등비수열","{'id': '603', 'name': '수열 > 등차수열과 등비수열 > 등비수열'}","{'id': '384', 'name': '등비수열의 첫째항부터 제 n 항까지의 합을 구할 수 있다.'}",96,20,0.9896907216494846
157,무한대,고등-수2-전체,"$x$의 값이 한없이 커지는 것을 기호 $\infty$를 사용하여 $x\to\infty$와 같이 나타내고, $x$의 값이 음수이면서 그 절댓값이 한없이 커지는 것을 $x\to-\infty$와 같이 나타낸다. 이때 $\infty$를 '무한대'라 읽는다.","{'id': '608', 'name': '함수의 극한과 연속 > 함수의 극한 > 함수의 극한의 뜻'}","{'id': '329', 'name': '함수의 극한의 뜻과 성질을 이해하고, 함수의 극한값을 구할 수 있다.'}",0,21,0.0
175,발산,고등-수2-전체,"함수 $f(x)$에서 $x$의 값이 $a$가 아니면서 $a$에 한없이 가까워질 때, $f(x)$가 수렴하지 않으면 $f(x)$는 발산한다고 한다.","{'id': '608', 'name': '함수의 극한과 연속 > 함수의 극한 > 함수의 극한의 뜻'}","{'id': '329', 'name': '함수의 극한의 뜻과 성질을 이해하고, 함수의 극한값을 구할 수 있다.'}",1,21,0.012345679012345678
176,양의 무한대로 발산,고등-수2-전체,"함수 $f(x)$에서 $x$의 값이 $a$가 아니면서 $a$에 한없이 가까워질 때, $f(x)$의 값이 한없이 커지면 함수 $f(x)$는 양의 무한대로 발산한다고 하고, 이것을 기호로 다음과 같이 나타낸다.\n$\lim _{x\to a}f(x)=\infty$ 또는 $x\to a$일 때 $f(x)\to\infty$\nRemark-> $\lim _{x\to a}f(x)=\infty$는 함수 $f(x)$의 $x=a$에서의 극한값이 $\infty$라는 것이 아니라, $f(x)$의 값이 한없이 커지는 상태라는 것을 나타낸다.","{'id': '608', 'name': '함수의 극한과 연속 > 함수의 극한 > 함수의 극한의 뜻'}","{'id': '329', 'name': '함수의 극한의 뜻과 성질을 이해하고, 함수의 극한값을 구할 수 있다.'}",2,21,0.024691358024691357
177,음의 무한대로 발산,고등-수2-전체,"함수 $f(x)$에서 $x$의 값이 $a$가 아니면서 $a$에 한없이 가까워질 때, $f(x)$의 값이 음수이면서 그 절댓값이 한없이 커지면 함수 $f(x)$는 음의 무한대로 발산한다고 하고, 이것을 기호로 다음과 같이 나타낸다.\n$\lim _{x\to a}f(x)=-\infty$  또는 $x\to a$일 때 $f(x)\to-\infty$","{'id': '608', 'name': '함수의 극한과 연속 > 함수의 극한 > 함수의 극한의 뜻'}","{'id': '352', 'name': '등비수열의 극한값을 구할 수 있다.'}",3,21,0.037037037037037035
223,"$x\to\infty$, $x\to-\infty$일 때의 함수의 발산",고등-수2-전체,"함수 $f(x)$에서 $x\to\infty$ 또는 $x\to-\infty$일 때, 함수 $f(x)가 양의 무한대 또는 음의 무한대로 발산하면 이것을 각각 기호로 다음과 같이 나타낸다.\n$\lim _{x\to\infty}f(x)=\infty$, $\lim _{x\to\infty}f(x)=-\infty$, $\lim _{x\to-\infty}f(x)=\infty$\n$\lim _{x\to-\infty}f(x)=-\infty$","{'id': '608', 'name': '함수의 극한과 연속 > 함수의 극한 > 함수의 극한의 뜻'}","{'id': '329', 'name': '함수의 극한의 뜻과 성질을 이해하고, 함수의 극한값을 구할 수 있다.'}",4,21,0.04938271604938271
224,우극한,고등-수2-전체,"함수 $f(x)$에서 $x$의 값이 $a$보다 크면서 $a$에 한없이 가까워질 때, $f(x)$의 값이 일정한 값 $\alpha$에 한없이 가까워지면 $\alpha$를 $f(x)$의 $x=a$에서의 우극한이라 하고, 이것을 기호로 다음과 같이 나타낸다. \n$\lim _{x\to a^+}f(x)=\alpha$ 또는 $x\to a^+$일 때 $f(x)\to\alpha$\nRemark> $x$의 값이 $a$보다 크면서 $a$에 한없이 가까워지는 것을 기호로 $x\to a^+$와 같이 나타낸다.","{'id': '608', 'name': '함수의 극한과 연속 > 함수의 극한 > 함수의 극한의 뜻'}","{'id': '329', 'name': '함수의 극한의 뜻과 성질을 이해하고, 함수의 극한값을 구할 수 있다.'}",5,21,0.06172839506172839
225,좌극한,고등-수2-전체,"함수 $f(x)$에서 $x$의 값이 $a$보다 작으면서 $a$에 한없이 가까워질 때, $f(x)$의 값이 일정한 값 $\beta$에 한없이 가까워지면 $\beta$를 $f(x)$의 $x=a$에서의 좌극한이라 하고, 이것을 기호로 다음과 같이 나타낸다.\n$\lim _{x\to a^-}f(x)=\beta$ 또는 $x\to a^-$일 때 $f(x)\to\beta$\nRemark> $x$의 값이 $a$보다 작으면서 $a$에 한없이 가까워지는 것을 기호로 $x\to a^-$와 같이 나타낸다.","{'id': '608', 'name': '함수의 극한과 연속 > 함수의 극한 > 함수의 극한의 뜻'}","{'id': '329', 'name': '함수의 극한의 뜻과 성질을 이해하고, 함수의 극한값을 구할 수 있다.'}",6,21,0.07407407407407407
226,극한값의 존재,고등-수2-전체,함수 $f(x)$의 $x=a$에서의 극한값이 $L$이면 $x=a$에서의 우극한과 좌극한이 모두 존재하고 그 값은 모두 $L$이다. 역으로 $x=a$에서의 우극한과 좌극한이 모두 존재하고 그 값이 $L$로 같으면 $\lim _{x\to a}f(x)=L$이다.\n즉 다음이 성립한다.$\lim _{x\to a}f(x)=L\iff\lim _{x\to a^+}f(x)=\lim _{x\to a^{_{}-}}f(x)=L$\nRemark> 함수 $f(x)$의 $x=a$에서의 우극한 또는 좌극한이 존재하지 않거나 모두 존재하더라도 그 값이 같지 않으면 극한값 $\lim _{x\to a}f(x)$는 존재하지 않는다.,"{'id': '608', 'name': '함수의 극한과 연속 > 함수의 극한 > 함수의 극한의 뜻'}","{'id': '329', 'name': '함수의 극한의 뜻과 성질을 이해하고, 함수의 극한값을 구할 수 있다.'}",7,21,0.08641975308641975
227,함수의 극한에 대한 성질,고등-수2-전체,"두 함수 $f(x), g(x)$에서 $\lim _{x\to a}f(x)=\alpha, \lim _{x\to a}g(x)=\beta$ ($\alpha, \beta$는 실수)일 때 다음이 성립한다.\n① $\lim _{x\to a}cf(x)=c\lim _{x\to a}f(x)=c\alpha$ (단, $c$는 상수)\n② $\lim _{x\to a}\lbrace f(x)+g(x)\rbrace=\lim _{x\to a}f(x)+\lim _{x\to a}g(x)=\alpha+\beta$\n③ $\lim _{x\to a}\lbrace f(x)-g(x)\rbrace=\lim _{x\to a}f(x)-\lim _{x\to a}g(x)=\alpha-\beta$\n④ $\lim _{x\to a}f(x)g(x)=\lim _{x\to a}f(x)\lim _{x\to a}g(x)=\alpha\beta$\n⑤ $\lim _{x\to a}\frac{f\mleft(x\mright)}{g(x)}=\frac{\lim _{x\to a}f(x)}{\lim _{x\to a}g(x)}=\frac{\alpha}{\beta}$(단, $\beta\ne0$)\nRemark> 위의 성질은 $x\to a^+, x\to a^-, x\to\infty, x\to-\infty$인 경우에도 모두 성립한다.","{'id': '609', 'name': '함수의 극한과 연속 > 함수의 극한 > 함수의 극한의 성질'}","{'id': '330', 'name': '함수의 극한의 뜻과 성질을 이해하고, 함수의 극한값을 구할 수 있다.'}",8,21,0.09876543209876543
320,증분,고등-수2-전체,"함수 $y=f(x)$에서 $x$의 값이 $a$에서 $b$까지 변할 때, 함숫값은 $f(a)$에서 $f(b)$까지 변한다. 이때,\n$x$의 값의 변화량 $b-a$를 $x$의 증분,\n$y$의 값의 변화량 $f(b)-f(a)$를 $y$의 증분이라 하고, 이것을 기호로 각각 $\differencedelta x,\differencedelta y$와 같이 나타낸다. 즉,\n$\differencedelta x=b-a$,\n$\differencedelta y=f(b)-f(a)=f(a+\differencedelta x)-f(a)$\nRemark> $\differencedelta$는 차를 뜻하는 Difference의 첫 글자 D에 해당하는 그리스 문자로 '델타(delta)'라 읽는다.","{'id': '612', 'name': '다항함수의 미분법 > 미분계수와 도함수 > 미분계수'}","{'id': '333', 'name': '미분계수의 뜻과 기하적 의미를 이해하고, 그 값을 구할 수 있다.'}",9,21,0.1111111111111111
375,미분가능,고등-수2-전체,"함수 $f(x)$의 $x=a$에서의 미분계수${f}^{\prime}(a)$가 존재할 때, 함수 $f(x)$는 $x=a$에서 미분 가능하다고 한다.\nRemark> 미분계수 ${f}^{\prime}(a)$가 존재하지 않을 때, 함수 $f(x)$는 $x=a$에서 미분 가능하지 않다고 한다.","{'id': '613', 'name': '다항함수의 미분법 > 미분계수와 도함수 > 미분가능성과 연속성'}","{'id': '335', 'name': '미분가능성과 연속성의 관계를 이해한다.'}",10,21,0.12345679012345678
376,미분가능한 함수,고등-수2-전체,함수 $f(x)$가 어떤 구간에 속하는 모든 $x$의 값에서 미분 가능하면 함수 $f(x)$는 그 구간에서 미분 가능하다고 한다.,"{'id': '613', 'name': '다항함수의 미분법 > 미분계수와 도함수 > 미분가능성과 연속성'}","{'id': '335', 'name': '미분가능성과 연속성의 관계를 이해한다.'}",11,21,0.13580246913580246
1210,함수의 극한에 대한 성질과 관련된 거짓 명제,고등-수2-전체,"함수의 극한에 대한 성질과 관련된 명제의 참·거짓을 판별하는 문제는 시험에 자주 나오는 유형이다. 대표적인 거짓인 명제들을 반례와 함께 확인해보자.\n$\lim _{x\to a}\lbrace f(x)+g(x)\rbrace$가 존재하면 $\lim _{x\to a}f(x)+\lim _{x\to a}g(x)$도 각각 존재한다. -> 거짓\n$\lim _{x\to a}f(x), \lim _{x\to a}f(x)g(x)$가 각각 존재하면 $\lim _{x\to a}g(x)$도 존재한다. ->거짓\n$\lim _{x\to a}f(x)=\infty,\lim _{x\to a}g(x)=\infty$이면 $\lim _{x\to a}\frac{f(x)}{g(x)}=1$이다. -> 거짓","{'id': '609', 'name': '함수의 극한과 연속 > 함수의 극한 > 함수의 극한의 성질'}","{'id': '330', 'name': '함수의 극한의 뜻과 성질을 이해하고, 함수의 극한값을 구할 수 있다.'}",12,21,0.14814814814814814
1211,미분계수를 이용한 극한값의 계산,고등-수2-전체,"$\frac{0}{0}$꼴의 극한값을 구할 때, 미분계수의 정의를 이용하면 간단히 해결되는 경우가 많다. 분모의 항의 개수에 따라 미분계수의 정의를 활용할 수 있는 식으로 변형하는 방법에 대하여 알아보자.\n⑴ 분모의 항이 $1$개인 경우 ->${f}^{\prime}(a)=\lim _{\differencedelta x\to0}\frac{f(a+\differencedelta x)-f(a)}{\differencedelta x}$를 이용한다.\n이상을 정리하면 다음과 같다.\n${f}^{\prime}(a)=\lim _{\square\to0}\frac{f(a+\square)-f(a)}{\square}$에서 $\square$가 모두 같아지도록 주어진 식을 변형한다.\n⑵ 분모의 항이 $2$개인 경우 -> ${f}^{\prime}(a)=\lim _{x\to a}\frac{f(x)-f(a)}{x-a}$를 이용한다.\n이상을 정리하면 다음과 같다.\n${f}^{\prime}(○)=\lim _{\triangle\to○}\frac{f(\triangle)-f(○)}{\triangle-○}$에서 $\triangle$는 $\triangle$ 끼리, $○$는 $○$끼리 서로 같아지도록 주어진 식을 변형한다.","{'id': '612', 'name': '다항함수의 미분법 > 미분계수와 도함수 > 미분계수'}","{'id': '333', 'name': '미분계수의 뜻과 기하적 의미를 이해하고, 그 값을 구할 수 있다.'}",13,21,0.16049382716049382
1212,함수가 미분가능하지 않은 경우,고등-수2-전체,함수 $f(x)$가 $x=a$에서 미분가능하지 않은 경우를 살펴보자.\n⑴ $x=a$에서 불연속인 경우\n⑵ 그래프가 $x=a$에서 꺾이는 경우,"{'id': '613', 'name': '다항함수의 미분법 > 미분계수와 도함수 > 미분가능성과 연속성'}","{'id': '335', 'name': '미분가능성과 연속성의 관계를 이해한다.'}",14,21,0.1728395061728395
